{
  "schema": "wea.contracts/v1",
  "schema_version": "1.0.0",
  "kind": "ContractBundle",
  "task": {
    "task_id": "sha256:5555555555555555555555555555555555555555555555555555555555555555",
    "objective": "Apply a bounded, verifiable patch.",
    "input_artifact_digests": [
      "sha256:1111111111111111111111111111111111111111111111111111111111111111"
    ],
    "acceptance_id": "sha256:3333333333333333333333333333333333333333333333333333333333333333",
    "permissions": {
      "capabilities": [
        "model.invoke",
        "process.exec",
        "repo.read",
        "repo.write"
      ],
      "filesystem": {
        "read": [
          "workspace://snapshot",
          "workspace://snapshot-out"
        ],
        "write": [
          "workspace://snapshot-out"
        ]
      },
      "network": "deny",
      "secrets": []
    },
    "budget": {
      "wall_time_ms": 60000,
      "model_tokens": 10000,
      "monetary_microunits": 1000000
    }
  },
  "acceptance": {
    "acceptance_id": "sha256:3333333333333333333333333333333333333333333333333333333333333333",
    "criteria": [
      {
        "criterion_id": "tests_pass",
        "assertion_digest": "sha256:6666666666666666666666666666666666666666666666666666666666666666",
        "verifier_digest": "sha256:7777777777777777777777777777777777777777777777777777777777777777",
        "required": true
      }
    ]
  },
  "artifacts": [
    {
      "artifact_digest": "sha256:1111111111111111111111111111111111111111111111111111111111111111",
      "logical_type": "wea/Artifact@1",
      "media_type": "application/json"
    },
    {
      "artifact_digest": "sha256:2222222222222222222222222222222222222222222222222222222222222222",
      "logical_type": "wea/Artifact@1",
      "media_type": "application/json"
    }
  ],
  "patches": [
    {
      "patch_digest": "sha256:4444444444444444444444444444444444444444444444444444444444444444",
      "base_artifact_digest": "sha256:1111111111111111111111111111111111111111111111111111111111111111",
      "result_artifact_digest": "sha256:2222222222222222222222222222222222222222222222222222222222222222",
      "format": "unified-diff",
      "touched_paths": [
        "src/parser.py"
      ]
    }
  ],
  "verifications": [
    {
      "verification_digest": "sha256:8888888888888888888888888888888888888888888888888888888888888888",
      "subject_digest": "sha256:4444444444444444444444444444444444444444444444444444444444444444",
      "acceptance_id": "sha256:3333333333333333333333333333333333333333333333333333333333333333",
      "results": [
        {
          "criterion_id": "tests_pass",
          "status": "pass",
          "evidence_digest": "sha256:9999999999999999999999999999999999999999999999999999999999999999"
        }
      ],
      "overall": "pass"
    }
  ]
}
